{
  "schema_version": "hm-va/0.1",
  "article_id": "hm-ai-game-tools-visual-pilot-20261009",
  "title": "Visual Pilot — บทเรียนจากการสร้างเกมด้วย AI: AI เก่งแค่ไหน ก็ต้องใช้เครื่องมือให้ถูกงาน",
  "slug": "visual-pilot-ai-game-tools",
  "dek": "จากประสบการณ์สร้างเกมด้วย AI หลายโปรเจกต์ พบว่าความสำเร็จไม่ได้ขึ้นกับโมเดลอย่างเดียว แต่ขึ้นกับการเลือกโครงสร้างและเครื่องมือที่ทำให้ AI ลงมือทำงานได้ตรงจุด",
  "category": "explained",
  "language": "th",
  "source_post_id": 52,
  "featured_media_id": 0,
  "status": "draft",
  "editorial_type": "owner-essay",
  "sources": [
    {
      "id": "src-owner-essay",
      "title": "บทเรียนจากการสร้างเกมด้วย AI: AI เก่งแค่ไหน ก็ต้องใช้เครื่องมือให้ถูกงาน",
      "url": "https://hybridmind.online/2026/10/09/ai-game-development-right-tools-godot-unreal-blender/",
      "published_at": "2026-10-09",
      "kind": "site-post"
    }
  ],
  "claims": [
    {
      "id": "claim-tool-selection",
      "text": "การเลือกเครื่องมือที่เหมาะสมช่วยลดการสร้างระบบพื้นฐานซ้ำและงานแก้ไข",
      "status": "owner-experience",
      "source_ids": [
        "src-owner-essay"
      ]
    },
    {
      "id": "claim-engines",
      "text": "Godot และ Unreal Engine ให้โครงสร้างงานเกมที่ AI สามารถใช้งานต่อยอดได้",
      "status": "unverified",
      "source_ids": [
        "src-owner-essay"
      ],
      "notes": "ต้องเทียบเอกสารจาก Godot/Unreal สำหรับรายละเอียดเวอร์ชันเมื่อใช้ในบทความอัตโนมัติ"
    },
    {
      "id": "claim-blender",
      "text": "Blender มี Modeling, Rigging, Animation และ Python สำหรับการทำงานอัตโนมัติ",
      "status": "unverified",
      "source_ids": [
        "src-owner-essay"
      ],
      "notes": "ใช้เป็นคำอธิบายทั่วไป; ถ้าจะยืนยันใหม่ควรอ้างอิง Blender documentation"
    }
  ],
  "modules": [
    {
      "id": "cover-visual",
      "type": "image",
      "title": "เครื่องมือที่เหมาะสมช่วยให้ AI ทำงานดีขึ้น",
      "media_id": 51,
      "src": "https://hybridmind.online/wp-content/uploads/2026/10/hybridmind-ai-game-development-tools-lessons.jpg",
      "alt": "อินโฟกราฟิกภาษาไทยเปรียบเทียบการเขียนเกมจากศูนย์ Godot Unreal Engine และ Blender โดยเน้นการจับคู่ AI กับเครื่องมือที่เหมาะสม",
      "caption": "ภาพประกอบของบทความต้นฉบับ • สรุปข้อดีและข้อจำกัดของแต่ละแนวทาง",
      "source_ids": [
        "src-owner-essay"
      ]
    },
    {
      "id": "at-a-glance",
      "type": "summary",
      "title": "สรุปประเด็นใน 10 วินาที",
      "bullets": [
        "AI เก่งแค่ไหนก็ต้องมีโครงสร้างที่เหมาะกับงาน",
        "ทำ MVP เล็ก ๆ อาจเริ่มที่ HTML / JavaScript ได้รวดเร็ว",
        "เกมที่มีระบบจริงใช้ Godot หรือ Unreal Engine ตามเป้าหมาย",
        "งานโมเดลสามมิติให้ AI ใช้เครื่องมือมาตรฐานอย่าง Blender"
      ],
      "source_ids": [
        "src-owner-essay"
      ]
    },
    {
      "id": "intro-original",
      "type": "narrative",
      "title": "บทนำ",
      "paragraphs": [
        "หลังจากที่ผมทดลองสร้างเกมด้วย AI มาหลายโปรเจกต์ ผมเริ่มค้นพบบทเรียนสำคัญอย่างหนึ่งว่า",
        "ประสิทธิภาพของ AI ไม่ได้ขึ้นอยู่กับความฉลาดของโมเดลเพียงอย่างเดียว แต่ขึ้นอยู่กับโครงสร้างและเครื่องมือที่เราให้มันทำงานด้วย",
        "หลายคนอาจคิดว่า เมื่อ AI เขียนโค้ดเก่งขึ้น เราก็แค่สั่งให้มันสร้างอะไรก็ได้ตามจินตนาการ แต่จากประสบการณ์จริง ผมพบว่าการเลือกเครื่องมือที่เหมาะสมตั้งแต่ต้น สามารถลดภาระงานของ AI ได้มหาศาล"
      ],
      "source_ids": [
        "src-owner-essay"
      ]
    },
    {
      "id": "tool-comparison",
      "type": "comparison",
      "title": "เลือกเครื่องมือให้เหมาะกับงาน",
      "items": [
        {
          "name": "HTML / JavaScript",
          "use_case": "ทดสอบแนวคิดเกมหรือ MVP",
          "strength": "เริ่มเร็วและเข้าถึงง่าย",
          "limitation": "ต้องสร้างโครงสร้างและระบบพื้นฐานเองเมื่อเกมซับซ้อน"
        },
        {
          "name": "Godot",
          "use_case": "เกม 2D หรือ 3D ที่ต้องการโครงสร้างชัด",
          "strength": "Scene, Node, Physics และ Animation พร้อมใช้",
          "limitation": "ต้องเรียนรู้สถาปัตยกรรมเอนจินและเวิร์กโฟลว์"
        },
        {
          "name": "Unreal Engine",
          "use_case": "เกม 3D ที่เน้นภาพและเทคนิคขั้นสูง",
          "strength": "Blueprint, Lumen, Nanite และระบบเรนเดอร์",
          "limitation": "ภาระเครื่องมือและทรัพยากรสูงกว่า โปรเจกต์ยังต้องปรับแต่งจริง"
        },
        {
          "name": "Blender",
          "use_case": "ทำโมเดล 3D, Rigging, Animation",
          "strength": "มีมาตรฐานงาน 3D และใช้ Python อัตโนมัติได้",
          "limitation": "ยังต้องตรวจ topology, rig, export และความเข้ากันได้กับเกม"
        }
      ],
      "source_ids": [
        "src-owner-essay"
      ]
    },
    {
      "id": "lessons-central",
      "type": "quote",
      "title": "แก่นที่สำคัญที่สุด",
      "text": "เราไม่ได้ทำให้ AI ฉลาดขึ้น แต่เราลดจำนวนปัญหาที่ AI ต้องแก้ด้วยตัวเองลง",
      "attribution": "บทเรียนจากผู้เขียน",
      "source_ids": [
        "src-owner-essay"
      ]
    },
    {
      "id": "chapter-1",
      "type": "narrative",
      "title": "1. เมื่อสั่ง AI สร้างเกมจากศูนย์",
      "paragraphs": [
        "ในช่วงแรก ผมทดลองสั่ง AI ให้สร้างเกมขึ้นมาโดยตรง โดยไม่ได้ใช้ Game Engine เฉพาะทาง",
        "AI สามารถสร้างเกมต้นแบบ (MVP) ที่เล่นได้จริงอย่างรวดเร็ว ซึ่งเป็นเรื่องน่าประทับใจมาก",
        "แต่เมื่อเริ่มพัฒนาเกมให้ซับซ้อนขึ้น ปัญหาก็ตามมา",
        "เราต้องคอยกำหนดรายละเอียดต่าง ๆ เองแทบทั้งหมด ไม่ว่าจะเป็นระบบตัวละคร การเคลื่อนไหว การชนกันของวัตถุ ระบบกล้อง การจัดการฉาก แอนิเมชัน หรือแม้แต่โครงสร้างในการจัดเก็บข้อมูล",
        "AI ไม่ได้มีกรอบการทำงานของเกมที่ชัดเจนให้ยึดถือ จึงต้องสร้างระบบขึ้นมาเองจำนวนมาก",
        "ยิ่งเกมใหญ่ขึ้น โค้ดยิ่งซับซ้อน การแก้ไขจุดหนึ่งอาจกระทบอีกจุดหนึ่ง และเราต้องเสียเวลาให้ AI กลับมาแก้ปัญหาเดิมซ้ำ ๆ",
        "ปัญหาไม่ได้อยู่ที่ AI เขียนโค้ดไม่เก่ง แต่อยู่ที่ เรากำลังให้ AI สร้างทั้งเกม และสร้างเครื่องมือพื้นฐานที่จำเป็นต่อการทำเกมไปพร้อมกัน"
      ],
      "source_ids": [
        "src-owner-essay"
      ]
    },
    {
      "id": "chapter-2",
      "type": "narrative",
      "title": "2. เมื่อเปลี่ยนมาใช้ Godot ทุกอย่างเริ่มมีโครงสร้าง",
      "paragraphs": [
        "ต่อมาผมเริ่มทดลองใช้ Godot ซึ่งเป็น Game Engine แบบ Open Source ที่มีเครื่องมือสำหรับสร้างเกม 2D และ 3D อยู่แล้ว",
        "สิ่งที่เปลี่ยนไปไม่ใช่แค่ภาษาเขียนโปรแกรม แต่คือสภาพแวดล้อมทั้งหมดที่ AI ใช้ทำงาน",
        "Godot มีระบบ Scene, Node, Physics, Animation, Input และโครงสร้างสำหรับจัดการองค์ประกอบของเกมอย่างเป็นระบบ",
        "แทนที่จะสั่ง AI ว่า \"ช่วยสร้างระบบตัวละครที่เคลื่อนไหวและชนสิ่งกีดขวางได้\"",
        "เราสามารถกำหนดให้ AI ใช้ระบบ CharacterBody และ CollisionShape ที่เอนจินเตรียมไว้ แล้วเขียนเฉพาะพฤติกรรมที่เราต้องการ",
        "นั่นหมายความว่า AI ไม่จำเป็นต้องประดิษฐ์ระบบฟิสิกส์หรือระบบจัดการฉากขึ้นมาใหม่",
        "มันสามารถใช้เครื่องมือมาตรฐานที่มีอยู่แล้ว และทุ่มความสามารถไปกับการสร้างระบบเกมจริง ๆ",
        "ที่สำคัญ เมื่อเกิดปัญหา เรายังสามารถตรวจสอบตามโครงสร้างที่ชัดเจน และอ้างอิงเอกสารของเอนจินได้ด้วย",
        "เราไม่ได้ทำให้ AI ฉลาดขึ้น แต่เราลดจำนวนปัญหาที่ AI ต้องแก้ด้วยตัวเองลง"
      ],
      "source_ids": [
        "src-owner-essay"
      ]
    },
    {
      "id": "working-process",
      "type": "process",
      "title": "เปลี่ยนจาก Prompt เดียวเป็นระบบการสร้างงาน",
      "steps": [
        {
          "label": "กำหนดเป้าหมาย",
          "detail": "รู้ก่อนว่าจะทดลอง MVP หรือสร้างเกมระยะยาว"
        },
        {
          "label": "เลือกเครื่องมือ",
          "detail": "จับคู่ Game Engine, Framework หรือเครื่องมือ 3D ให้เหมาะสม"
        },
        {
          "label": "ให้ AI ลงมือทำ",
          "detail": "สั่งงานบน API และโครงสร้างที่มีเอกสารรองรับ"
        },
        {
          "label": "ทดสอบและตรวจสอบ",
          "detail": "ตรวจพฤติกรรม ฟิสิกส์ ภาพ และข้อผิดพลาดตามมาตรฐาน"
        },
        {
          "label": "ปรับปรุงต่อเนื่อง",
          "detail": "แก้เฉพาะจุดและเก็บข้อมูลเพื่อพัฒนารอบถัดไป"
        }
      ],
      "source_ids": [
        "src-owner-essay"
      ]
    },
    {
      "id": "chapter-3",
      "type": "narrative",
      "title": "3. เมื่อขยับไปสู่ Unreal Engine",
      "paragraphs": [
        "หากต้องการพัฒนาเกม 3D ที่เน้นภาพสมจริง เครื่องมืออย่าง Unreal Engine ก็ให้อีกระดับของความพร้อม",
        "Unreal มีระบบเรนเดอร์ แสง เงา วัสดุ ฟิสิกส์ เครื่องมือสร้างฉาก และระบบ Visual Scripting อย่าง Blueprint",
        "เทคโนโลยีอย่าง Lumen และ Nanite ช่วยให้การพัฒนาภาพสามมิติคุณภาพสูงมีเครื่องมือรองรับตั้งแต่ต้น โดยไม่จำเป็นต้องสร้างระบบเรนเดอร์เหล่านี้เอง",
        "แน่นอนว่าไม่ได้หมายความว่าเปิด Unreal แล้วจะได้เกมกราฟิกระดับ AAA ทันที เรายังต้องมีโมเดล ฉาก วัสดุ การจัดแสง และการปรับประสิทธิภาพที่เหมาะสม",
        "แต่สิ่งสำคัญคือ เรามีโครงสร้างและเทคโนโลยีที่พร้อมให้ AI นำไปใช้ต่อยอด",
        "แทนที่จะให้ AI เขียนระบบกราฟิกทั้งหมดขึ้นมาใหม่ เราสามารถให้มันช่วยจัดการฉาก เขียน Blueprint สร้างระบบเกม และปรับแต่งองค์ประกอบภายในเอนจินที่มีความสามารถเหล่านั้นอยู่แล้ว",
        "Unreal Engine เองก็ไม่ได้จำเป็นต้องเสียเงินเพื่อเริ่มพัฒนาเกม โดยมีเงื่อนไขค่าลิขสิทธิ์ตามประเภทการใช้งานและรายได้ของผลิตภัณฑ์",
        "ดังนั้นประเด็นจึงไม่ใช่ว่าเอนจินไหนแพงกว่าหรือดีกว่าเสมอไป แต่คือเอนจินไหนเหมาะกับสิ่งที่เรากำลังสร้างมากที่สุด"
      ],
      "source_ids": [
        "src-owner-essay"
      ]
    },
    {
      "id": "chapter-4",
      "type": "narrative",
      "title": "4. งานสร้างโมเดล 3D ก็มีบทเรียนแบบเดียวกัน",
      "paragraphs": [
        "อีกตัวอย่างหนึ่งคือการสร้างโมเดลสามมิติ",
        "ถ้าเราสั่ง AI ให้สร้างโมเดลโดยไม่มีเครื่องมือเฉพาะทางรองรับ เราอาจต้องคอยปรับแก้รูปร่าง สัดส่วน พื้นผิว และโครงสร้างของโมเดลหลายรอบ",
        "ยิ่งต้องการโมเดลที่นำไปใช้งานในเกมจริง ปัญหาเรื่องโครงกระดูก การเคลื่อนไหว และการส่งออกไฟล์ก็ยิ่งมีรายละเอียดมากขึ้น",
        "แต่เมื่อใช้ Blender เราได้เครื่องมือมาตรฐานสำหรับ Modeling, Rigging, Animation, Materials และการจัดการวัตถุสามมิติ",
        "AI สามารถช่วยสร้างสคริปต์ Python เพื่อควบคุมเครื่องมือใน Blender สร้างวัตถุ ปรับตำแหน่ง จัดองค์ประกอบ หรือทำงานที่ซ้ำกันโดยอัตโนมัติ",
        "ผลลัพธ์จึงมีโครงสร้างที่ตรวจสอบและปรับแก้ต่อได้ง่ายกว่าการพยายามสร้างทุกอย่างโดยไม่มีระบบรองรับ",